#name_urlized	about	tags
__page	A place for us.	#
practitioners	Who's who is an allopathic manner	#doctors
healers-and-therapists	AYUSH and Counsellors	#co-healing
those-whove-overcome	People with issues who are now supporting others	#be-strong
support-and-carers	Family and friends of those with health issues (PWLE)	#support
networks	Some in India, some abroad	#heal #global
stay-connected	Those wanting to help and be helped	#pwle #crises
heal-by-encouragement	A new approach that [Imran](%url%users/imran/healing-through-words/) is tring to evolve in a DIY manner.	#words #tailored-affirmations #comforting
